<?xml version="1.0" encoding="UTF-8"?>
<!ELEMENT Theater (Details+)>
<!ELEMENT Details (Movie,Generes)>
<!ELEMENT Movie (#PCDATA)>
<!ELEMENT Generes (#PCDATA)>
